sensor,platform,algorithm,id,order,name,input_name,output_name,netCDF_varName,netCDF_standard_name,netCDF_long_name,netCDF_description,landSubdivisionStatId,calc_suffix_n_prefix,label,type_in_STC,type_in_mosaics,type,type_web,netCDF_type,units_in_stc,units_in_mosaics,units_in_map,units_in_plot,netCDF_units,multiplicator_for_mosaics,divisor,nodata_value,nodata_value_web,value_for_unreliable,value_for_unreliable_web,min,max,value_precision,test_calc_albedos,test_calc_snow_cover_days,test_write_mosaic,write_geotiffs,write_mosaics,write_stats_csv,write_stc,write_netCDF_v2022_0,write_netCDF_v2023_1,mosaicSubsetSCAGDRFS,modis_source_name,modis_source,mod09ga_name,mod09ga_bitPosition,mod09ga_bitCount,mod09ga_type,mod09ga_nodata_value,mod09ga_min,mod09ga_max,mod09ga_scale,mod09ga_resamplingFactor,spires_name,run_spires_output,spires_weightFactor00,spires_weightFactor01,spires_weightFactor02,spires_weightFactor03,spires_weightFactor04,spires_weightFactor05,spires_weightFactor06,spires_weightFactor07,spires_weightFactor08,spires_weightFactor09,spires_weightFactor10,spires_weightFactor11,spires_weightFactor12,spires_weightFactor13,spires_weightFactor14,spires_weightFactor15,spirescube_type,spirescube_nodata_value,web_ispresent,web_layer_type,web_longname,web_longnameplot,web_label_map_legend,web_label_plot_yaxis,web_helptext,web_value_precision,web_colormap_id,web_colormap_value_min,web_colormap_value_max,web_transparent_zero,web_sensor_text,web_order,comments
,,,unique id of the variable. NB: must be unique per sensor/platform/algorithm/output_name. Mustnt be changed,order of handling in algorithm. Not used everywhere. Can be modified.,0,Variable name in stc files,"variable name in Mosaics, PublicMosaics/geotiffs",variable name in netCDF files,standard_name attribute in netCDF files,long_name attribute in netCDF files,description variable attribute in netCDF files,"id of the daily statistic to apply to the variable on the landsubdivisions (to transfer to the website, class Subdivision). The descriptions associated to these id are in configuration_of_landsubdivisionstats.csv",prefix or suffix of field calculated in runStatsForLinePlots(),Description (label) in Regions.writeStats(),Data type in Stc files,Data type in Mosaic files,Data type by default,Data type for PublicMosaic/geotiffs,Data type in netCDF files,Units in stc cubes,"Units indicated in Mosaics, except for albedos","Units indicated in stat files, in stc files for snow_cover_days, in mosaic files for albedo.",deprecated.,"units attribute for netCDF files (must be UDUNITS, ref: https://ncics.org/portfolio/other-resources/udunits2/",Factor by which we multiply the value of the variable in the stc intermediary file to obtain the value inserted in Mosaic files.,"Factor multiplied by min-max values to get the min-max values in Mosaics. Divisor applied on mosaic values to obtain PublicMosaic/geotiff value. Other divisors are extracted form Mosaics/or this file for runStatsLineFor, and hardcoded for STCSCAG_DRFS_snow.",No data value inserted in intermediary and mosaic files which type is integer (and not single/double).,No data value inserted in geotiff or other files sent to the snowToday frontend.,Value for pixels below thresholds (handled within Mosaic) inserted in Mosaics or other intermediary files.,Value for pixels below thresholds (handled within PublicMosaic) inserted in geotiff or other files sent to the snowToday frontend.,Minimal value of the variable (in Mosaics),Maximal value of the variable (in Mosaics),sent to the website,1: the variable is integrated in the unit test of Variables.calcAlbedos(). 0: the variable is not integrated.,1: the variable is integrated in the unit test of Variables.calcSnowCoverDays(). 0: the variable is not integrated.,1: the variable is integrated in the unit test of Mosaic.runWriteFiles(). 0: the variable is not integrated.,1: a geotiff is generated for the variable in Step3 (regions.runWriteGeotiffs()). 0: no geotiff generated.,1: the variable is inserted in the daily mosaic data file in Step2 (mosaic.runWriteFiles()). 0: the variable is not inserted.,"1: the variable is integrated in statistic calculation. 0: the variable is not integrated. NB: if you edit this, dont forget to edit configuration_of_filepaths.csv and adding rows corresponding to variables",1: the variable is integrated in stc. 0: the variable is not integrated.,1: the variable is integrated in statistic calculation. 0: the variable is not integrated.,1: the variable is written to ESPnetCDF files 0:not written,1: the variable is inserted in the modscagdrfs raw file. 0: the variable is not inserted,Name of the variable in the modis original file we import during Step0,"Indicates whether the variable originates from mod09ga .hdf file, modscag .dat file or moddrfs .dat file, all files being imported in Step0",,"If the variable is a bit-part of the modis composite variable, indicate the bit-position of the variable. E.g. cloud is a bit-part of state_1km_1, and bit-position is 0. If the variable is fully extracted from the modis variable, modis_bitPosition = 255 (no data).","If the variable is a bit-part of the modis composite variable, indicate the number of bits that the variable occupies. If modis_bitPosition = 255, this field is not considered.",,,,,,"Indicates if the variable is in a lower resolution than the expected, by which factor we need to resample. E.g. if expected is 500m, and the variable is in 1000m, resamplingFactor = 2.",Name of the variable returned by the spires.core.run_spires() method.,,Smoothing-weight if the variable = 0. For spires smoothing only.,Smoothing-weight if the variable = 1. For spires smoothing only.,Smoothing-weight if the variable = 2. For spires smoothing only.,Smoothing-weight if the variable = 3. For spires smoothing only.,Smoothing-weight if the variable = 4. For spires smoothing only.,Smoothing-weight if the variable = 5. For spires smoothing only.,Smoothing-weight if the variable = 6. For spires smoothing only.,Smoothing-weight if the variable = 7. For spires smoothing only.,Smoothing-weight if the variable = 8. For spires smoothing only.,Smoothing-weight if the variable = 9. For spires smoothing only.,Smoothing-weight if the variable = 10. For spires smoothing only.,Smoothing-weight if the variable = 11. For spires smoothing only.,Smoothing-weight if the variable = 12. For spires smoothing only.,Smoothing-weight if the variable = 13. For spires smoothing only.,Smoothing-weight if the variable = 14. For spires smoothing only.,Smoothing-weight if the variable = 15. For spires smoothing only.,,,,web_xx: attributes that are sent in the variables.json and in the root region .json for the website,,,,,,,,,,,,,Comment on the variable
modis,terra,scagdrfs/stc,48,48,,,albedo_clean_mu0,albedo_clean_mu0,none,STC-MODSCAG/MODDRFS clean snow albedo assuming flat surface,"Reflected fraction of broadband (0.28-4.00 micrometer) solar radiation, based on optical grain size from MODSCAG, no adjustment to account for slope and aspect of the terrain",3,,,single,uint8,uint8,uint8,NC_UBYTE,,percent,percent,percent,%,1,1,255,255,255,255,0,100,0,0,0,0,0,0,0,0,1,0,,,,,255,,,,,,,,,,0,0,0,0,0,0,0,0,0,0,0,0,0,0,0,0,,,0,raster,,,,,,,,,,,MODIS (Terra) scagdrfs/stc,48,
modis,terra,scagdrfs/stc,49,49,,,albedo_observed_mu0,albedo_observed_mu0,none,STC-MODSCAG/MODDRFS snow albedo assuming flat surface darkened by light-absorbing particles,"Reflected fraction of broadband (0.28-4.00 micrometer) solar radiation, based on optical grain size from MODSCAG accounting for darkening by light-absorbing impurities from MODDRFS deltavis, no adjustment to account for slope and aspect of the terrain",3,,,single,uint8,uint8,uint8,NC_UBYTE,,percent,percent,percent,%,1,1,255,255,255,255,0,100,0,0,0,0,0,0,0,0,1,0,,,,,255,,,,,,,,,,0,0,0,0,0,0,0,0,0,0,0,0,0,0,0,0,,,0,raster,,,,,,,,,,,MODIS (Terra) scagdrfs/stc,49,
modis,terra,scagdrfs/stc,50,50,Clean Snow Albedo,,albedo_clean_muZ,albedo_clean_muZ,none,STC-MODSCAG/MODDRFS clean snow albedo on slope,"Reflected fraction of broadband (0.28-4.00 micrometer) solar radiation, based on optical grain size from MODSCAG, adjusted to account for slope and aspect of the terrain",3,albedo,Median Regional Snow Albedo,single,uint8,uint8,uint8,NC_UBYTE,,percent,percent,percent,%,1,1,255,255,255,255,0,100,0,0,0,0,1,0,0,0,0,1,,,,,255,,,,,,,,,,0,0,0,0,0,0,0,0,0,0,0,0,0,0,0,0,,,0,raster,Clean Snow Albedo,Average Clean Snow Albedo,"Snow Albedo (%, for Snow >=10%)",Albedo (%), ,0,1,65,85,false,MODIS (Terra) scagdrfs/stc,50,
modis,terra,scagdrfs/stc,51,51,Snow Albedo,,albedo_observed_muZ,albedo_observed_muZ,none,STC-MODSCAG/MODDRFS snow albedo on slope darkened by light-absorbing particles,"Reflected fraction of broadband (0.28-4.00 micrometer) solar radiation, based on optical grain size from MODSCAG accounting for darkening by light-absorbing impurities from MODDRFS deltavis, adjusted to account for slope and aspect of the terrain",3,albedo,Median Regional Snow Albedo,single,uint8,uint8,uint8,NC_UBYTE,,percent,percent,percent,%,1,1,255,255,255,255,0,100,0,0,0,0,1,0,1,0,0,1,,,,,255,,,,,,,,,,0,0,0,0,0,0,0,0,0,0,0,0,0,0,0,0,,,1,raster,Snow Albedo,Average Snow Albedo,"Snow Albedo (%, for Snow >=10%)",Albedo (%),"Fresh, clean snow with a high albedo appears bright, while old or dirty snow tends to have a lower albedo and appears darker. The snow albedo measurement is a non-dimensional, unitless quantity that measures how well a surface reflects solar energy, ranging from 0 to 1. A value of 0 means the surface is a perfect absorber, where all incoming energy is absorbed, while a value of 1 means the surface is a perfect reflector, where all incoming energy is reflected and none is absorbed. This quantity can also be expressed as a percent with a range from 0 to 100, with zero percent absorbing all incoming energy and 100 percent reflecting all energy.",0,1,65,85,false,MODIS (Terra) scagdrfs/stc,51,
modis,terra,scagdrfs/stc,43,43,Decrease in visible Albedo from Dust and Soot,DVT,deltavis,deltavis,none,STC-MODDRFS decrease in snow albedo from light absorbing particles,Difference between observed visible broadband (0.350-0.876 micrometer) albedo and clean snow albedo estimated from MODDRFS grain size,3,deltavis,,single,uint8,uint8,uint8,NC_UBYTE,percent,percent,percent,percent,%,1,1,255,255,255,255,0,75,0,1,0,1,1,1,1,1,1,1,1,deltavis,moddrfs,,255,,,,,,,1,,,0,0,0,0,0,0,0,0,0,0,0,0,0,0,0,0,,,1,raster,Decrease in visible Albedo from Dust and Soot,,"Decrease in Albedo (%, for Snow >=10%)",Decrease in Albedo (%),,0,2,0,30,false,MODIS (Terra) scagdrfs/stc,43,
modis,terra,scagdrfs/stc,41,41,Snow Grain Size,GmT,grain_size,grain_size,snow_grain_size,STC-MODSCAG grain size,Optical snow grain size based on MODSCAG spectral mixture analysis,3,,,single,uint16,uint16,uint16,NC_USHORT,microns,microns,micrometers,micrometers,micrometer,1,1,65535,65535,65535,65535,10,1100,0,1,0,1,1,1,0,1,1,1,1,grain_size,modscag,,255,,,,,,,1,,,0,0,0,0,0,0,0,0,0,0,0,0,0,0,0,0,,,1,raster,Snow Grain Size,,Micrometers (for Snow >=10%),micrometers, ,0,3,50,600,false,MODIS (Terra) scagdrfs/stc,41,
modis,terra,scagdrfs/stc,42,42,,GdT,drfs_grnsz,drfs_grnsz,snow_grain_size,STC-MODDRFS grain size,Optical snow grain size based on MODDRFS normalized difference grain size index,3,,,single,uint16,uint16,uint16,NC_USHORT,microns,microns,micrometers,micrometers,micrometer,1,1,65535,65535,65535,65535,10,1100,0,0,0,1,0,1,0,1,1,1,1,drfs.grnsz,moddrfs,,255,,,,,,,1,,,0,0,0,0,0,0,0,0,0,0,0,0,0,0,0,0,,,0,raster,,,,,,,3,,,,MODIS (Terra) scagdrfs/stc,42,check min max and units
modis,terra,scagdrfs/stc,44,44,Snow Radiative Forcing,RFT,radiative_forcing,radiative_forcing,surface_downward_heat_flux_in_snow,STC-MODDRFS radiative forcing on snow,Additional energy absorbed by the snowpack from light-absorbing impurities assuming a clear sky,3,radiative_forcing,Median Regional Snow Radiative Forcing,single,uint16,uint16,uint16,NC_USHORT,W/m^2,W/m^2,Watts per square meter,Watts per square meter,W/m^2,1,1,65535,65535,65535,65535,0,500,0,1,0,1,1,1,1,1,1,1,1,forcing,moddrfs,,255,,,,,,,1,,,0,0,0,0,0,0,0,0,0,0,0,0,0,0,0,0,,,1,raster,Snow Radiative Forcing,Average Snow Radiative Forcing,"Energy (W m^2, for Snow >=10%)",Energy (Watts per square meter),"When snow impurities such as dust or soot fall on snow, its surface darkens and absorbs more solar energy. Snow radiative forcing is a measure of the additional absorption of solar radiation from light absorbing particles (LAP) such as dust or soot. Units of measure are Watts per square meter (W/m2) and values can range from 0 to 500 W/m2. This maximum value depends on incoming solar radiation (elevation, direct sun vs shaded) and the amount of dust or soot. A value of 0 means no additional radiation is being absorbed. A value of 500 means nearly all of the solar energy is absorbed (depends on latitude, elevation, clouds). Radiative forcing is calculated by the difference between the net (downward minus upward) radiative fluxes (irradiance) with and without LAP.",0,4,0,100,false,MODIS (Terra) scagdrfs/stc,44,
modis,terra,scagdrfs/stc,13,13,,SolAzimuth,solar_azimuth,solar_azimuth,solar_azimuth_angle,STC-MOD09GA solar azimuth,"MOD09GA solar azimuth linearly interpolated to fill spatial gaps, used with terrain slope and aspect to estimate albedo_clean_muZ and albedo_observed_muZ",3,,,int16,int16,int16,int16,NC_SHORT,degrees,degrees,degrees,degrees,degrees,1,1,32767,32767,32767,32767,-180,180,0,1,0,1,0,1,0,1,0,1,0,SolarAzimuth_1,mod09ga,SolarAzimuth_1,255,,int16,-32767,0,18000,0.01,2,,,0,0,0,0,0,0,0,0,0,0,0,0,0,0,0,0,,,0,raster,,,,,,,,,,,MODIS (Terra) scagdrfs/stc,13,check type and min max
modis,terra,scagdrfs/stc,14,14,,SolZ,solar_zenith,solar_zenith,solar_zenith_angle,STC-MOD09GA solar zenith,"MOD09GA solar zenith linearly interpolated to fill spatial gaps, used with terrain slope and aspect to estimate albedo_clean_muZ and albedo_observed_muZ",3,,,uint8,uint8,uint8,uint8,NC_UBYTE,degrees,,,,degrees,1,1,255,255,255,255,0,90,0,1,0,1,0,1,0,1,0,1,0,SolarZenith_1,mod09ga,SolarZenith_1,255,,int16,-32767,-18000,18000,0.01,2,,,0,0,0,0,0,0,0,0,0,0,0,0,0,0,0,0,,,0,raster,,,,,,,,,,,MODIS (Terra) scagdrfs/stc,14,check type
modis,terra,scagdrfs/stc,45,45,Snow Cover Days,,snow_cover_days,snow_cover_duration,none,STC-MODSCAG snow cover duration,The number of days since the start of the water year with a value greater than the threshold for viewable snow cover fraction,2,scd_sum,Snow Cover Days,single,uint16,uint16,uint16,NC_USHORT,,days,days,days,days,1,1,65535,65535,0,0,0,366,0,1,0,1,1,1,1,0,0,1,,,,,255,,,,,,,,,,0,0,0,0,0,0,0,0,0,0,0,0,0,0,0,0,,,1,raster,Snow Cover Days,Average Snow Cover Days,Snow Cover Days (>=14),Snow Cover Days,The number of days a region has been covered with snow as identified with snow cover percent greater than a snow cover percent threshold since a starting time. Our data uses 15% as the snow percent threshold and October 1 as the starting date for these maps.,3,5,1,{lastDayOfData,true,MODIS (Terra) scagdrfs/stc,45,
modis,terra,scagdrfs/stc,40,40,Snow Cover Percent,STc,snow_fraction,snow_fraction,surface_snow_area_fraction,STC-MODSCAG on the ground snow fraction,Viewable snow fraction corrected for canopy obstruction using forest height and vegetation fraction,1,sca_area_km2,Total Snow Cover Area,single,uint8,uint8,uint8,NC_UBYTE,fraction,percent,percent,Area (thousands of square kilometers),%,100,1,255,255,0,0,0,100,0,1,1,1,1,1,1,1,1,1,,,,,255,,,,,,,,,,0,0,0,0,0,0,0,0,0,0,0,0,0,0,0,0,,,1,raster,Snow Cover Percent,Total Snow Cover Area,Snow Cover (>=10%),Area (thousands of square kilometers),"The areal extent of snow-covered ground, expressed as the mathematical percent of a region covered with snow. In the context of this website, the region refers to an Earth observing satellite's smallest measurement area. We use data from the Moderate Resolution Imaging Spectroradiometer at ~463m spatial resolution. Note that the Earth's surface is sometimes covered by clouds.",0,6,1,100,true,MODIS (Terra) scagdrfs/stc,40,
modis,terra,scagdrfs/stc,36,36,Viewable Snow Cover Percent,STv,viewable_snow_fraction,viewable_snow_fraction,snow_area_fraction_viewable_from_above,STC-MODSCAG viewable snow fraction,Snow fraction from surface reflectance visible from satellite,1,,,single,uint8,uint8,uint8,NC_UBYTE,fraction,percent,percent,Area (thousands of square kilometers),%,100,1,255,255,0,0,0,100,0,1,0,1,1,1,0,1,1,1,1,snow_fraction,modscag,,255,,,,,,,1,,,0,0,0,0,0,0,0,0,0,0,0,0,0,0,0,0,,,1,raster,Viewable Snow Cover Percent,,Snow Cover (>=10%),Area (thousands of square kilometers), ,0,6,1,100,true,MODIS (Terra) scagdrfs/stc,36,
modis,terra,scagdrfs/stc,38,38,,,vegetation_fraction,vegetation_fraction,,,,,,,,,uint8,,,,,,,%,,,,,,,,,,,,,,,,0,0,0,1,vegetation_fraction,modscag,,255,,,,,,,1,,,0,0,0,0,0,0,0,0,0,0,0,0,0,0,0,0,,,0,raster,,,,,,,,,,,MODIS (Terra) scagdrfs/stc,38,
modis,terra,scagdrfs/stc,37,37,,,rock_fraction,rock_fraction,,,,,,,,,uint8,,,,,,,%,,,,,,,,,,,,,,,,0,0,0,1,rock_fraction,modscag,,255,,,,,,,1,,,0,0,0,0,0,0,0,0,0,0,0,0,0,0,0,0,,,0,raster,,,,,,,,,,,MODIS (Terra) scagdrfs/stc,37,
modis,terra,scagdrfs/stc,39,39,,,other_fraction,other_fraction,,,,,,,,,uint8,,,,,,,%,,,,,,,,,,,,,,,,0,0,0,1,other_fraction,modscag,,255,,,,,,,1,,,0,0,0,0,0,0,0,0,0,0,0,0,0,0,0,0,,,0,raster,,,,,,,,,,,MODIS (Terra) scagdrfs/stc,39,
modis,terra,scagdrfs/stc,46,46,,viewable_snow_fraction_status,viewable_snow_fraction_status,viewable_snow_fraction_status,none,STC viewable snow fraction status,Flag value indicating the reason for ignoring or masking the satellite derived viewable snow fraction,1,,Mask observed / interpolated,uint8,uint8,uint8,uint8,NC_UBYTE,w/o units,w/o units,w/o units,w/o units,unitless,1,1,0,0,0,0,0,255,0,0,0,1,0,1,0,1,0,1,0,,,,255,,,,,,,,,,0,0,0,0,0,0,0,0,0,0,0,0,0,0,0,0,,,0,raster,,,,,,,,,,,MODIS (Terra) scagdrfs/stc,46,"not to indicate in mosaicSubsetSCAGDRFS, but we do insert in raw files"
modis,terra,scagdrfs/stc,47,47,,,days_without_observation,days_since_last_observation,none,STC days since last observation at this pixel,The number of days since the snow surface was last seen by the sensor,3,,Number of days without observation,uint16,uint16,uint16,uint16,NC_USHORT,,days,days,days,days,1,1,65535,65535,65535,65535,0,366,3,0,0,0,0,0,0,0,0,1,0,,,,255,,,,,,,,,,0,0,0,0,0,0,0,0,0,0,0,0,0,0,0,0,,,0,raster,,,,,,,,,,,MODIS (Terra) scagdrfs/stc,47,"Not to indicate in write_mosaics, but we do insert after generating the Mosaic "
modis,terra,original,10,10,,,num_observations_1km,,,,,,,,,,,,,,,,,,,,,,,,,,,,,,,,,,,,,num_observations_1km,mod09ga,num_observations_1km,255,,int8,-1,0,127,1,2,,,0,0,0,0,0,0,0,0,0,0,0,0,0,0,0,0,,,0,raster,,,,,,,,,,,,10,
modis,terra,original,11,11,,,state_1km,,,,,,,,,,,,,,,,,,,,,,,,,,,,,,,,,,,,,state_1km_1,mod09ga,state_1km_1,255,,uint16,65535,0,57335,1,2,,,0,0,0,0,0,0,0,0,0,0,0,0,0,0,0,0,,,0,raster,,,,,,,,,,,,11,check on min-max in mod09ga not implemented in code.
modis,terra,original,12,12,,,sensor_zenith,,,,,,,,,,,,,,,,,,,,,,,,,,,,,,,,,,,,,SensorZenith_1,mod09ga,SensorZenith_1,255,,int16,-32767,0,18000,0.01,2,,,0,0,0,0,0,0,0,0,0,0,0,0,0,0,0,0,,,0,raster,,,,,,,,,,,,12,
modis,terra,original,8,8,,,num_observations_500m,,,,,,,,,,,,,,,,,,,,,,,,,,,,,,,,,,,,,num_observations_500m,mod09ga,num_observations_500m,255,,int8,-1,0,127,1,1,,,0,0,0,0,0,0,0,0,0,0,0,0,0,0,0,0,,,0,raster,,,,,,,,,,,,8,
modis,terra,original,9,9,,,QC_500m,,,,,,,,,,,,,,,,,,,,,,,,,,,,,,,,,,,,,QC_500m_1,mod09ga,QC_500m_1,255,,uint32,4294967295,0,4294966019,1,1,,,0,0,0,0,0,0,0,0,0,0,0,0,0,0,0,0,,,0,raster,,,,,,,,,,,,9,check on min-max in mod09ga not implemented in code.
modis,terra,original,1,1,,,reflectance,,,,,,,,,,,,,,,,,,,,,,,,,,,,,,,,,,,,,sur_refl_b01_1,mod09ga,sur_refl_b01_1,255,,int16,-28672,-100,16000,0.0001,1,,,0,0,0,0,0,0,0,0,0,0,0,0,0,0,0,0,,,0,raster,,,,,,,,,,,,1,"in snowToday, reflectance min limit is -100 but in spires its 0"
modis,terra,original,2,2,,,reflectance,,,,,,,,,,,,,,,,,,,,,,,,,,,,,,,,,,,,,sur_refl_b02_1,mod09ga,sur_refl_b02_1,255,,int16,-28672,-100,16000,0.0001,1,,,0,0,0,0,0,0,0,0,0,0,0,0,0,0,0,0,,,0,raster,,,,,,,,,,,,2,
modis,terra,original,3,3,,,reflectance,,,,,,,,,,,,,,,,,,,,,,,,,,,,,,,,,,,,,sur_refl_b03_1,mod09ga,sur_refl_b03_1,255,,int16,-28672,-100,16000,0.0001,1,,,0,0,0,0,0,0,0,0,0,0,0,0,0,0,0,0,,,0,raster,,,,,,,,,,,,3,
modis,terra,original,4,4,,,reflectance,,,,,,,,,,,,,,,,,,,,,,,,,,,,,,,,,,,,,sur_refl_b04_1,mod09ga,sur_refl_b04_1,255,,int16,-28672,-100,16000,0.0001,1,,,0,0,0,0,0,0,0,0,0,0,0,0,0,0,0,0,,,0,raster,,,,,,,,,,,,4,
modis,terra,original,5,5,,,reflectance,,,,,,,,,,,,,,,,,,,,,,,,,,,,,,,,,,,,,sur_refl_b05_1,mod09ga,sur_refl_b05_1,255,,int16,-28672,-100,16000,0.0001,1,,,0,0,0,0,0,0,0,0,0,0,0,0,0,0,0,0,,,0,raster,,,,,,,,,,,,5,
modis,terra,original,6,6,,,reflectance,,,,,,,,,,,,,,,,,,,,,,,,,,,,,,,,,,,,,sur_refl_b06_1,mod09ga,sur_refl_b06_1,255,,int16,-28672,-100,16000,0.0001,1,,,0,0,0,0,0,0,0,0,0,0,0,0,0,0,0,0,,,0,raster,,,,,,,,,,,,6,
modis,terra,original,7,7,,,reflectance,,,,,,,,,,,,,,,,,,,,,,,,,,,,,,,,,,,,,sur_refl_b07_1,mod09ga,sur_refl_b07_1,255,,int16,-28672,-100,16000,0.0001,1,,,0,0,0,0,0,0,0,0,0,0,0,0,0,0,0,0,,,0,raster,,,,,,,,,,,,7,
modis,terra,original,15,15,,,cloud,,,,,,,,,,uint8,,,,,,,,,,,,,,0,3,,,,,,,,,,,,state_1km_1,mod09ga,state_1km_1,0,2,uint8,,,,,,,,1,0.5,0.5,1,0,0,0,0,0,0,0,0,0,0,0,0,,,0,raster,,,,,,,,,,,,15,
modis,terra,original,16,16,,,cloudshadow,,,,,,,,,,uint8,,,,,,,,,,,,,,0,1,,,,,,,,,,,,state_1km_1,mod09ga,state_1km_1,2,1,uint8,,,,,,,,1,0.8,0,0,0,0,0,0,0,0,0,0,0,0,0,0,,,0,raster,,,,,,,,,,,,16,
modis,terra,original,17,17,,,landwater,,,,,,,,,,uint8,,,,,,,,,,,,,,0,7,,,,,,,,,,,,state_1km_1,mod09ga,state_1km_1,3,3,uint8,,,,,,,,0.8,1,0.8,0.8,0.8,0,0,0,0,0,0,0,0,0,0,0,,,0,raster,,,,,,,,,,,,17,
modis,terra,original,18,18,,,aerosol,,,,,,,,,,uint8,,,,,,,,,,,,,,0,3,,,,,,,,,,,,state_1km_1,mod09ga,state_1km_1,6,2,uint8,,,,,,,,1,1,0.5,0.25,0,0,0,0,0,0,0,0,0,0,0,0,,,0,raster,,,,,,,,,,,,18,
modis,terra,original,19,19,,,cirrus,,,,,,,,,,uint8,,,,,,,,,,,,,,0,3,,,,,,,,,,,,state_1km_1,mod09ga,state_1km_1,8,2,uint8,,,,,,,,1,1,0.5,0.25,0,0,0,0,0,0,0,0,0,0,0,0,,,0,raster,,,,,,,,,,,,19,
modis,terra,original,20,20,,,Intcloudflag,,,,,,,,,,uint8,,,,,,,,,,,,,,0,1,,,,,,,,,,,,state_1km_1,mod09ga,state_1km_1,10,1,uint8,,,,,,,,0,0,0,0,0,0,0,0,0,0,0,0,0,0,0,0,,,0,raster,,,,,,,,,,,,20,
modis,terra,original,21,21,,,Intfireflag,,,,,,,,,,uint8,,,,,,,,,,,,,,0,1,,,,,,,,,,,,state_1km_1,mod09ga,state_1km_1,11,1,uint8,,,,,,,,0,0,0,0,0,0,0,0,0,0,0,0,0,0,0,0,,,0,raster,,,,,,,,,,,,21,
modis,terra,original,22,22,,,MOD35snow,,,,,,,,,,uint8,,,,,,,,,,,,,,0,1,,,,,,,,,,,,state_1km_1,mod09ga,state_1km_1,12,1,uint8,,,,,,,,0,0,0,0,0,0,0,0,0,0,0,0,0,0,0,0,,,0,raster,,,,,,,,,,,,22,
modis,terra,original,23,23,,,cloudadj,,,,,,,,,,uint8,,,,,,,,,,,,,,0,1,,,,,,,,,,,,state_1km_1,mod09ga,state_1km_1,13,1,uint8,,,,,,,,0,0,0,0,0,0,0,0,0,0,0,0,0,0,0,0,,,0,raster,,,,,,,,,,,,23,
modis,terra,original,24,24,,,saltpan,,,,,,,,,,uint8,,,,,,,,,,,,,,0,1,,,,,,,,,,,,state_1km_1,mod09ga,state_1km_1,14,1,uint8,,,,,,,,0,0,0,0,0,0,0,0,0,0,0,0,0,0,0,0,,,0,raster,,,,,,,,,,,,24,
modis,terra,original,25,25,,,Intsnow,,,,,,,,,,uint8,,,,,,,,,,,,,,0,1,,,,,,,,,,,,state_1km_1,mod09ga,state_1km_1,15,1,uint8,,,,,,,,0,0,0,0,0,0,0,0,0,0,0,0,0,0,0,0,,,0,raster,,,,,,,,,,,,25,
modis,terra,original,26,26,,,modland,,,,,,,,,,uint8,,,,,,,,,,,,,,0,3,,,,,,,,,,,,QC_500m_1,mod09ga,QC_500m_1,0,2,uint8,,,,,,,,1,0.5,0,0,0,0,0,0,0,0,0,0,0,0,0,0,,,0,raster,,,,,,,,,,,,26,
modis,terra,original,27,27,,,bandQA1,,,,,,,,,,uint8,,,,,,,,,,,,,,0,15,,,,,,,,,,,,QC_500m_1,mod09ga,QC_500m_1,2,4,uint8,,,,,,,,1,0,0,0,0,0,0,0,0,0.052335956242944,0.078459095727845,0,0.5,0.25,0,0,,,0,raster,,,,,,,,,,,,27,
modis,terra,original,28,28,,,bandQA2,,,,,,,,,,uint8,,,,,,,,,,,,,,0,15,,,,,,,,,,,,QC_500m_1,mod09ga,QC_500m_1,6,4,uint8,,,,,,,,1,0,0,0,0,0,0,0,0,0.052335956242944,0.078459095727845,0,0.5,0.25,0,0,,,0,raster,,,,,,,,,,,,28,
modis,terra,original,29,29,,,bandQA3,,,,,,,,,,uint8,,,,,,,,,,,,,,0,15,,,,,,,,,,,,QC_500m_1,mod09ga,QC_500m_1,10,4,uint8,,,,,,,,1,0,0,0,0,0,0,0,0,0.052335956242944,0.078459095727845,0,0.5,0.25,0,0,,,0,raster,,,,,,,,,,,,29,
modis,terra,original,30,30,,,bandQA4,,,,,,,,,,uint8,,,,,,,,,,,,,,0,15,,,,,,,,,,,,QC_500m_1,mod09ga,QC_500m_1,14,4,uint8,,,,,,,,1,0,0,0,0,0,0,0,0,0.052335956242944,0.078459095727845,0,0.5,0.25,0,0,,,0,raster,,,,,,,,,,,,30,
modis,terra,original,31,31,,,bandQA5,,,,,,,,,,uint8,,,,,,,,,,,,,,0,15,,,,,,,,,,,,QC_500m_1,mod09ga,QC_500m_1,18,4,uint8,,,,,,,,1,0,0,0,0,0,0,0,0,0.052335956242944,0.078459095727845,0,0.5,0.25,0,0,,,0,raster,,,,,,,,,,,,31,
modis,terra,original,32,32,,,bandQA6,,,,,,,,,,uint8,,,,,,,,,,,,,,0,15,,,,,,,,,,,,QC_500m_1,mod09ga,QC_500m_1,22,4,uint8,,,,,,,,1,0,0,0,0,0,0,0,0,0.052335956242944,0.078459095727845,0,0.5,0.25,0,0,,,0,raster,,,,,,,,,,,,32,
modis,terra,original,33,33,,,bandQA7,,,,,,,,,,uint8,,,,,,,,,,,,,,0,15,,,,,,,,,,,,QC_500m_1,mod09ga,QC_500m_1,26,4,uint8,,,,,,,,1,0,0,0,0,0,0,0,0,0.052335956242944,0.078459095727845,0,0.5,0.25,0,0,,,0,raster,,,,,,,,,,,,33,
modis,terra,original,34,34,,,atmosCorr,,,,,,,,,,uint8,,,,,,,,,,,,,,0,1,,,,,,,,,,,,QC_500m_1,mod09ga,QC_500m_1,30,1,uint8,,,,,,,,0.8,1,0,0,0,0,0,0,0,0,0,0,0,0,0,0,,,0,raster,,,,,,,,,,,,34,
modis,terra,original,35,35,,,adjCorr,,,,,,,,,,uint8,,,,,,,,,,,,,,0,1,,,,,,,,,,,,QC_500m_1,mod09ga,QC_500m_1,31,1,uint8,,,,,,,,0.9,1,0,0,0,0,0,0,0,0,0,0,0,0,0,0,,,0,raster,,,,,,,,,,,,35,
modis,terra,spires,52,52,,,viewable_snow_fraction_s,,,,,,,,,,,,,,,,,,,,255,255,,,0,100,,,,,,,,,,,,,,,,,,,,,,,fsca,1,0,,,,,,,,,,,,,,,,uint8,255,1,raster,Viewable Snow Cover Percent,,Snow Cover (>=10%),Area (thousands of square kilometers), ,0,6,1,100,true,MODIS (Terra) spires,52,
modis,terra,spires,53,53,,,shade_fraction_s,,,,,,,,,,,,,,,,,,,,255,255,,,0,100,,,,,,,,,,,,,,,,,,,,,,,fshade,1,0,,,,,,,,,,,,,,,,uint8,255,0,raster,,,,,,,,,,,MODIS (Terra) spires,53,
